[
  {
    "minutes":90,
    "notes":"Detox completed early, got the value I needed",
    "todos":"Double-check the laundry skill lists to make sure they're correct - I strategically let AI form them from a 20-question prompt",
    "highlights":"Updated profile again, using AI to scaffold trained on my voice, then rewrote parts in my voice."
  }
]
