[
  {
    "minutes":45,
    "notes":"Listened to 1 Nephi 13 in DE, ZH, SP",
    "todos":"Heard 'Youden' many times in German -- haven't looked it up yet, trying to see how long it takes for it to click into place on its own.",
    "highlights":"Test of endurance listening to all 3 languages today"
  }
]
