[
  {
    "minutes":30,
    "notes":"Day 7 of AI detox",
    "todos":"Add a consultation option to Upwork. Don't sweat it at all if no one bites -- I'm patient.",
    "highlights":"Breakthrough on updating Upwork profile to weave in all of these other projects I've been doing for fun/myself. Seems they have professional value if I continue to build them out."
  }
]
