[
  {
    "minutes":45,
    "notes":"Listened to Book of Mormon Chapters 1-3 first in Spanish then in Chinese",
    "todos":"Listen specifically for words that repeat and remember to ask GPT about them",
    "highlights":"Starting to get the rhythm of both languages in scriptures aurally"
  },
  {
    "minutes":60,
    "notes":"The Rational Life Finale and Everybody Loves Me",
    "todos":"Figure out a way to get better at understanding the faster slangy speech -- maybe ask GPT about how to do this specifically for the dialog in this one",
    "highlights":"Mandarin subtitles -- I vaguely remember when they used to be chicken scratch to me"
  }
]
