[
  {
    "minutes":130,
    "notes":"Listened to a bunch of Du Chinese stories, specifically around Liu Bei and the mountain scholar (Three Kingdoms 5)",
    "todos":"Keep reading Du Chinese as the subscription expires in less than a month",
    "highlights":"Practiced Book of Mormon terms, recorded chapter summaries up to French 3 (1 Ne 4)"
  }
]
