[
  {
    "minutes":120,
    "notes":"Ran heavy duty polyglot test, including 5 sentences on the same thread in 5 languages --> 5 sentences each with two languages smashed together",
    "todos":"Continue to practice production in Chinese / Spanish / German and learn more basics in Russian",
    "highlights":"Learned that even GPT cannot produce examples that follow the rules 100% because it's so complex for it"
  }
]
