[
  {
    "minutes":10,
    "notes":"Slightly better today, still a little wheezy towards the end of the day.",
    "todos":"Keep taking small doses of Niquil to sleep which seems to produce the most healing effect",
    "highlights":"Stretched with the kids"
  },
  {
    "minutes":15,
    "notes":"Stationary bike",
    "todos":"Keep working harder and harder to strengthen legs",
    "highlights":"Pumped harder and didn't record voice -- need to make sure I push myself"
  }
]
