[
  {
    "minutes":10,
    "notes":"Biking",
    "todos":"Continue to stretch after biking",
    "highlights":"Read Chinese and pedaled moderately"
  },
  {
    "minutes":30,
    "notes":"Walked around mall",
    "todos":"Watch angle of foot when walking longer distances",
    "highlights":"Found new sneakers to help with foot padding and comfort while walking/running"
  }
]
