[
  {
    "minutes":60,
    "notes":"Worked on Skritter",
    "todos":"Frontload Levels 1-2, then load Level 3 in appropriate increments to stress test SRS for a year",
    "highlights":"Started Band 3, tried to ban my old words to prevent from review, decided to turn off 2/4 exercises as Brainscape and Du Chinese cover them already"
  },
  {
    "minutes":90,
    "notes":"Read Du Chinese",
    "todos":"Read at least 1 chapter a day",
    "highlights":"Read Phantom Cang Hua and a few other chapters, slowly acquiring a little bit of HSK 2.0 5+ but slowly"
  }
]
