[
  {
    "minutes":40,
    "notes":"Duolingo (SP), Skritter (CH), Drops (DE), Lingodeer (RU), Du Chinese (CH)",
    "todos":"Figured out that switching phone to French enables native French ChatGPT advanced voice, practiced for a while",
    "highlights":"Read Phantom Thief Cang Hua chapters 5-6"
  }
]
