[
  {
    "minutes":180,
    "notes":"Designed Dec 29 plan to learn ~600 high leverage vocab words related to LDS doctrine; Skritter (CH), Drops (DE), Lingodeer (RU), Du Chinese (CH)",
    "todos":"Review next batch of 25 words",
    "highlights":"Took multiple tests across all languages (FR C1, SP B2, CH B2, DE B1, RU A1 -- slightly inflated on SP/CH/DE)"
  }
]
