[
  {
    "minutes":15,
    "notes":"Stationary bike",
    "todos":"Add slightly more speed",
    "highlights":"Stayed moving the whole time"
  },
  {
    "minutes":10,
    "notes":"Bus stop running",
    "todos":"Stretch after getting back home",
    "highlights":"Got kid's coat quickly by running"
  },
  {
    "minutes":10,
    "notes":"Stretching before bed",
    "todos":"Don't push too hard on side stretches",
    "highlights":"Feeling less achy in general"
  }
]
