[
  {
    "minutes":40,
    "notes":"Drew pictures for Resonant Patterns in Procreate by hand without AI",
    "todos":"Keep AI out of the initial phase of this project -- at some point it will make sense, but I don't know when yet",
    "highlights":"Worked on new essay Scars Visible without AI"
  }
]
