[
  {
    "minutes":15,
    "notes":"Listened to Book of Mormon Chapter 6 DE->ZH->SP->ZH->DE which seemed to help",
    "todos":"Continue forward",
    "highlights":"Surprisingly dense in German and Chinese, hard to pick out the words even on 2nd listen"
  },
  {
    "minutes":60,
    "notes":"Listened to Boss & Me",
    "todos":"Write down phrases I hear that are clear but don't recognize.",
    "highlights":"Caught some new phrases about New Years and that one of the characters was had, got tricked"
  }
]
