[
  {
    "minutes":90,
    "notes":"Purchased Skritter 1-year subscription",
    "todos":"Frontload Levels 1-2, then load Level 3 in appropriate increments to stress test SRS for a year",
    "highlights":"Went through Band 1 Levels 1-2 and generated over 2,000 exercises to grind through up front"
  }
]
