[
  {
    "minutes":120,
    "notes":"Ran intensive stress test against AI's ability to reason about my corpus of writing",
    "todos":"Sounds like a really interesting set of essays if I can flesh out the process more first",
    "highlights":"Learned about GPT and Claude's differences from GPT's perspective. I'll ask Claude later about it."
  }
]
