[
  {
    "minutes":180,
    "notes":"Completed Essay 8 without AI in first draft",
    "todos":"Record YY and Me Episode 7 -- this should predate Essay 8 because it literally does in my notes offline",
    "highlights":"Ran through AI, it flattened the final version, kept both drafts for cross analysis"
  }
]
