[
  {
    "minutes":150,
    "notes":"Finished Essay 8 on Trusting the Process (scrapped prior draft), wrote Essay 1 on Why Write Now",
    "todos":"Record YY and Me Episode 7",
    "highlights":"Completed the first arc in preparation for the next one: Pro Pun City with the kids as eventual co-authors"
  }
]
