[
  {
    "minutes":60,
    "notes":"Spinach Cheese + Egg + English Muffin",
    "todos":"I made a big mess, but squeezing the water out of the spinach wasn't as bad as I had expected.",
    "highlights":"Kids helped with the English Muffins and some stirring; wife helped with eggs and general coaching"
  }
]
