[
  {
    "minutes":150,
    "notes":"Day 4 of AI detox",
    "todos":"Record another stream of consciousness on bike",
    "highlights":"Published Scars Visible; decided not to publish Playing in Stereo or Trusting the Process, will instead rewrite them from scratch and save the originals for a future AI comparison"
  }
]
