[
  {
    "minutes":50,
    "notes":"Walked while listening to scriptures",
    "todos":"Spend a little more time standing and less time sitting at computer desk",
    "highlights":"Kept my eyes closed to sneak a little extra rest"
  },
  {
    "minutes":15,
    "notes":"Stationary bike",
    "todos":"Pay more attention to the general RPMs to ensure I'm speeding up little by little",
    "highlights":"Read Chinese again while continuing to push a little"
  }
]
