[
  {
    "minutes":10,
    "notes":"1 Nephi 5 (FR)",
    "todos":"Look up a new word that I com across",
    "highlights":"Used YY Method to notice that Sariah's perspective might not be fully accurately represented due to patriarchal narrative lens.  What would she have recorded differently?"
  }
]
