[
  {
    "minutes":15,
    "notes":"Stationary bike",
    "todos":"Continue recording language while on bike -- makes it extra tough which is good?",
    "highlights":"Practiced French out loud while biking"
  },
  {
    "minutes":10,
    "notes":"Bus stop walking",
    "todos":"Get back to running tomorrow",
    "highlights":"Walked mostly today to stretch out legs"
  },
  {
    "minutes":10,
    "notes":"Stretching before bed",
    "todos":"Focus on the hanging down stretch",
    "highlights":"Helps me fall asleep faster"
  }
]
