[
  {
    "minutes":45,
    "notes":"Worked on Skritter",
    "todos":"Finish adding 7-9 group and look for any other interesting writing exercises before end of trial",
    "highlights":"Added HSK 3.0 Handwriting currently on 7-9 group"
  },
  {
    "minutes":45,
    "notes":"Read Du Chinese",
    "todos":"Read at least 1 chapter a day",
    "highlights":"Read Phantom Cang Hua Chapter 11, enjoying the storyline"
  }
]
